name,description,url,type,usage_count
MCPet,"Adopt, nurture, and play with your very own digital companion that evolves based on your care. Manage your pet's stats, engage in fun activities, and watch them grow from a baby to an adult. Experience a nostalgic virtual pet simulation powered by modern AI.",https://smithery.ai/server/@shreyaskarnik/mcpet,Local,
Zig Server,"Enhance AI capabilities with Zig language tooling, code analysis, and documentation.",https://smithery.ai/server/zig-mcp-server,Remote,
Obsidian Integration Server,"Interact seamlessly with your Obsidian vault using a powerful MCP server. Retrieve, search, and modify your notes effortlessly, enhancing your productivity and organization. Leverage the capabilities of Claude to summarize and manage your notes with ease.",https://smithery.ai/server/@Jordanm37/mcp-obsidian,Remote,
Atlassian Bitbucket Integration,"Access and manage your Bitbucket repositories, pull requests, and commits directly from AI assistants. Enhance your workflow by integrating Bitbucket data seamlessly into your AI interactions. Utilize a customizable server to connect your AI systems with Atlassian Bitbucket securely and efficiently.",https://smithery.ai/server/@aashari/mcp-server-atlassian-bitbucket,Remote,
FluentLab Funding Assistant,Access a variety of funding options and required documents for applications. Streamline your funding search and application process with our easy-to-use API. Get started quickly and efficiently with the tools provided by FluentLab.,https://smithery.ai/server/@fundfluent-admin/funding-assistant,Remote,
LLM Bridge,Interact seamlessly with multiple large language models through a unified interface. Switch between different LLM providers effortlessly and customize your interactions with adjustable parameters. Enhance your AI applications with powerful language model capabilities without the hassle of managing multiple integrations.,https://smithery.ai/server/@sjquant/llm-bridge-mcp,Remote,
Daily Todo,Manage your tasks efficiently with a simple and intuitive interface. Stay organized and boost your productivity by keeping track of your daily to-dos. Get started quickly and enjoy a seamless experience in task management.,https://smithery.ai/server/@jeezliu/daily-todo,Remote,
Macrostrat API Server,"Query comprehensive geologic data and information using natural language. Analyze geological data to enhance understanding and create graphics from the data. Access a wide range of geologic units, minerals, and timescales effortlessly.",https://smithery.ai/server/@blake365/macrostrat-mcp,Remote,
GitHub API MCP Server,"Manage your GitHub repositories effortlessly. Create, update, and search for files, issues, and pull requests with ease, all while preserving your Git history. Streamline your development workflow by automating repository management tasks.",https://smithery.ai/server/@iamadk/github,Remote,
QRCode_MCP,Generate simple QR codes with customizable styles.,https://smithery.ai/server/@1595901624/qrcode-mcp,Local,
Sketchup Integration,"Connect Sketchup to Claude AI for enhanced 3D modeling and scene manipulation. Utilize prompts to create, modify, and control components directly within Sketchup, enabling advanced operations through Ruby code execution.",https://smithery.ai/server/@BearNetwork-BRNKC/SketchUp-MCP,Remote,
EMQX MCP Server,A Model Context Protocol (MCP) server implementation that provides EMQX MQTT broker interaction.,https://smithery.ai/server/@Benniu/emqx-mcp-server,Remote,
Ethereum RPC Server,Interact with the Ethereum blockchain seamlessly. Query blockchain data like account balances and gas prices through standardized JSON-RPC methods. Enhance your AI applications with real-time Ethereum data access.,https://smithery.ai/server/@0xKoda/eth-mcp,Remote,
Atom of Thoughts,"Enhance your applications with intelligent thought processing capabilities. Leverage advanced language models to generate, analyze, and manipulate ideas seamlessly. Transform your workflows with powerful context-aware interactions.",https://smithery.ai/server/@kbsooo/mcp_atom_of_thoughts,Local,
Gaode Weather,Fetch current weather information for your city using the Gaode Map API. Easily integrate weather data into your applications and enhance user experience with real-time updates. Start building your weather-aware applications today!,https://smithery.ai/server/@kevinkelin/mcp-gaodeweather-server,Remote,
Image Extractor,MCP server for extracting and converting images to base64 for LLM analysis.,https://smithery.ai/server/@ifmelate/mcp-image-extractor,Local,
Chroma MCP Server,"Integrate vector database capabilities into your LLM applications. Effortlessly manage collections, perform semantic searches, and retrieve data with advanced filtering. Enhance your AI models with powerful data retrieval features for improved context and performance.",https://smithery.ai/server/@chroma-core/chroma-mcp,Remote,
BrasilAPI MCP Server,"Query a variety of data from Brasil resources seamlessly. Access information on postal codes, area codes, banks, holidays, taxes, and more through a unified interface. Enhance your AI agents and applications with rich and updated data from BrasilAPI effortlessly.",https://smithery.ai/server/@mauricio-cantu/brasil-api-mcp-server,Remote,
Clickzetta Server,Enable seamless database interactions and insights analysis with SQL queries. Run complex queries and manage data efficiently while gaining valuable insights through a dynamic memo resource. Enhance your data-driven applications with powerful tools for querying and analysis.,https://smithery.ai/server/@yunqiqiliang/mcp-clickzetta-server,Remote,
Beyond MCP Server,Access social platform data and onchain data seamlessly. Integrate multiple social media platforms with ease and extend functionality as needed. Optimize your LLM interactions with well-formatted context and flexible transport options.,https://smithery.ai/server/@Beyond-Network-AI/beyond-mcp-server,Remote,
Cal Server,"Evaluate mathematical expressions efficiently and accurately. Input your expressions and receive instant results, leveraging built-in constants like PI and E. Perfect for quick calculations and mathematical evaluations in a lightweight service.",https://smithery.ai/server/@pwh-pwh/cal-mcp,Remote,
Image Extractor,MCP server for extracting and converting images to base64 for LLM analysis.,https://smithery.ai/server/@ifmelate/mcp-image-extractor,Local,
Amazon Selling Partner API Integration Server,"Manage your Amazon seller account effortlessly. Create reports, update prices, and get inventory summaries with seamless integration to the Amazon Selling Partner API. Streamline your operations and enhance your selling experience on Amazon.",https://smithery.ai/server/@eliteamz/amazon-sp-mcp-server,Remote,
Reference Servers,"Showcase the versatility of Large Language Models by providing secure, controlled access to various tools and data sources. Leverage a collection of reference implementations to enhance your applications with powerful integrations. Start building your own MCP servers with ease using our comprehensive resources and community support.",https://smithery.ai/server/@leogodlike/reference-servers,Local,
Singapore LTA MCP Server,"Access real-time transportation information for Singapore. Get bus arrivals, traffic conditions, and train service updates seamlessly.",https://smithery.ai/server/@arjunkmrm/mcp-sg-lta,Remote,
Memory Box MCP Server,"Save, search, and format memories with semantic understanding. Enhance your memory management by leveraging advanced semantic search capabilities directly from Cline. Organize and retrieve your memories efficiently with structured formatting and detailed context.",https://smithery.ai/server/@amotivv/memory-box-mcp,Remote,
Clickzetta Server,Enable seamless database interactions and insights analysis with SQL queries. Run complex queries and manage data efficiently while gaining valuable insights through a dynamic memo resource. Enhance your data-driven applications with powerful tools for querying and analysis.,https://smithery.ai/server/@yunqiqiliang/mcp-clickzetta-server,Remote,
Compress Files,"Provides file compression and decompression services, supporting multiple formats such as gzip, tar.gz, ZIP, and 7z. Simplifies file processing workflows through standardized interfaces, ensuring security and efficiency.",https://smithery.ai/server/@tuskermanshu/compress-mcp-server,Local,
Flightradar24 Server,Track flights in real-time using Flightradar24 data. Perfect for aviation enthusiasts or travel planners.,https://smithery.ai/server/flightradar24-mcp-server,Remote,
GitLab Merge Request Integration,"Interact seamlessly with GitLab repositories to manage merge requests and issues. Fetch details, add comments, and streamline your code review process with ease.",https://smithery.ai/server/@kopfrechner/gitlab-mr-mcp,Remote,
Logo MCP,Get logos for most companies like Google.com and Apple.com in various styles. No API key required.,https://smithery.ai/server/@szypetike/logomcp-server,Remote,
Oura API Integration Server,"Access sleep, readiness, and resilience data from the Oura API.",https://smithery.ai/server/@tomekkorbak/oura-mcp-server,Remote,
SWAPI Server,"Provide seamless access to Star Wars API data for your applications. Fetch, manipulate, and integrate Star Wars universe information effortlessly. Enhance your projects with rich, structured data from the iconic franchise.",https://smithery.ai/server/@alexandrebagio/swapi-mcp,Remote,
Desktop Commander,Execute terminal commands and manage processes seamlessly on your computer. Enhance your coding workflow with advanced file editing capabilities and real-time output streaming. Simplify your development tasks with powerful command execution and file manipulation tools.,https://smithery.ai/server/@zhanyiwp/desktopcommandermcp,Remote,
Hive MCP Server,"Connect AI assistants to the Hive blockchain. Fetch account details, retrieve posts, vote on content, and send tokens securely. Enhance your AI's capabilities with blockchain interactions and cryptographic functions.",https://smithery.ai/server/@gluneau/hive-mcp-server,Local,
Twitter Interaction Server,"Enable your AI models to seamlessly interact with Twitter. Create posts, follow users, and retrieve tweets effortlessly through a standardized API. Enhance your applications with powerful Twitter functionalities at your fingertips.",https://smithery.ai/server/@0xhijo/mcp_twitter,Remote,
OpenAI Agent Library,Enhance your applications with powerful language model capabilities. Integrate seamlessly with external data and tools to create intelligent agents that can perform complex tasks. Empower your projects with dynamic interactions and real-world data manipulation.,https://smithery.ai/server/@Yaxin9Luo/openai_agent_library_mcp,Remote,
LinkedIn Digital Intelligence Server,"Interact with LinkedIn's Digital Intelligence services to create and analyze reports, gain insights, and receive typeahead suggestions. Leverage this server to enhance your LinkedIn data analysis capabilities securely and efficiently.",https://smithery.ai/server/@AudienseCo/mcp-audiense-di-linkedin,Remote,
Todoist MCP Server,"Integrate your AI assistants with Todoist for seamless task management. Manage tasks, projects, comments, and labels using natural language commands. Enhance your productivity by interacting with Todoist through conversational AI.",https://smithery.ai/server/@stanislavlysenko0912/todoist-mcp-server,Remote,
Zotero MCP,"Connect your Zotero research library with AI assistants to discuss papers, get summaries, and analyze citations. Enhance your research workflow by seamlessly integrating your library with Claude and other tools.",https://smithery.ai/server/@54yyyu/zotero-mcp,Remote,
Brazilian Postal Code Server,"Query Brazilian postal code (CEP) information effortlessly. Retrieve complete address details including street, neighborhood, city, state, and more using just the postal code. Integrate seamlessly with AI agents through the Model Context Protocol.",https://smithery.ai/server/@guilhermelirio/brazilian-cep-mcp,Remote,
Todoist MCP Server,"Integrate your AI assistants with Todoist for seamless task management. Manage tasks, projects, comments, and labels using natural language commands. Enhance your productivity by interacting with Todoist through conversational AI.",https://smithery.ai/server/@stanislavlysenko0912/todoist-mcp-server,Remote,
Notion MCP,"Manage your personal todo list seamlessly with Notion's API. Add, update, and view tasks directly from your workspace using a simple and efficient interface. Enhance your productivity by integrating your tasks with a powerful Model Context Protocol server.",https://smithery.ai/server/@Badhansen/notion-mcp,Remote,
Ableton Live Integration,"Connect Claude AI to Ableton Live for prompt-assisted music production and track manipulation. Control playback, create MIDI clips, and manage your music sessions seamlessly with AI assistance.",https://smithery.ai/server/@kydycode/ableton-mcp-boost,Local,
Code2Prompt MCP Server,Enable seamless integration of code generation and prompt engineering capabilities into your applications. Leverage the power of the Model Context Protocol to enhance your development workflow with dynamic context and tools. Start building smarter applications that understand and generate code effectively.,https://smithery.ai/server/@ODAncona/code2prompt,Local,
Document Operations Server,"Enable seamless document manipulation for Microsoft Word, Excel, and PDF files. Create, edit, and convert documents effortlessly, enhancing your productivity with Claude Desktop. Streamline your document workflows with powerful operations at your fingertips.",https://smithery.ai/server/@alejandroBallesterosC/document-edit-mcp,Remote,
Dida365 (TickTick) MCP Server,"Manage your tasks and projects seamlessly with Dida365. Authenticate and interact with your Dida365 account to create, update, and delete tasks and projects effortlessly. Enhance your productivity by integrating task management directly into your AI assistants.",https://smithery.ai/server/@iamjzx/dida,Local,
Horoscope MCP Server,"Fetch daily horoscope readings and detailed fortune insights for all zodiac signs. Get personalized predictions on love, career, health, and more, tailored to your zodiac sign and time range. Enhance your decision-making with lucky numbers and compatibility advice.",https://smithery.ai/server/@GBcui/horoscope-serve,Local,
TypeScript Definition Finder,"Locate the original definitions of TypeScript symbols in your codebase effortlessly. Enhance your AI code editor's capabilities by integrating this tool to find definitions of imported symbols, classes, interfaces, or functions. Get precise location and code snippets to streamline your development process.

This is a stdio server which can only run locally. Just do:
`npx -y ts-def-mcp@latest`",https://smithery.ai/server/@runninghare/typescript-definition-finder-mcp,Local,
Opik MCP Server,"Integrate seamlessly with your IDE and access all Opik features through a standardized protocol. Manage prompts, projects, and metrics efficiently with a unified interface. Leverage multiple transport options for flexible integration into various environments.",https://smithery.ai/server/@comet-ml/opik-mcp-server,Remote,
Transcription Tools,"Enhance your transcription workflow with intelligent processing capabilities. Automatically repair errors, format transcripts naturally, and generate concise summaries to save time and improve accuracy.",https://smithery.ai/server/@MushroomFleet/transcriptiontools-mcp,Local,
SCAST,Convert code into UML diagrams and flowcharts effortlessly. Analyze your code statically and visualize it using advanced tools like Mermaid and D3. Enhance your understanding of code structure and flow with this intuitive visualization tool.,https://smithery.ai/server/@davidkingzyb/scast,Local,
Logaflow,Enhance your applications with real-time logging and monitoring capabilities. Streamline your data flow and gain insights effortlessly with our powerful tools. Integrate seamlessly and elevate your development experience.,https://smithery.ai/server/@antunesgabriel/logaflow-mcp-server,Remote,
Semantic Scholar Server,"Search for academic papers, retrieve detailed information, and access citations and references seamlessly. Enhance your research capabilities by integrating with the Semantic Scholar API for efficient paper management and discovery.",https://smithery.ai/server/@JackKuo666/semanticscholar-mcp-server,Remote,
YouTube Transcription Server,Transcribe YouTube videos effortlessly with this server. Leverage the power of MCP to integrate transcription capabilities into your applications. Enhance your projects by adding accurate and fast video transcriptions from YouTube content.,https://smithery.ai/server/@seanlee10/server-youtube-transcription,Remote,
Autumn MCP Server,"Access the Autumn pricing API effortlessly to manage your customers. Create, retrieve, and manage customer entitlements and invoices, all through a simple interface. Generate billing portal links to enhance customer experience and streamline billing processes.",https://smithery.ai/server/@SirTenzin/autumn-mcp-server,Remote,
ABAP-ADT-API MCP-Server,1:1 wrapping of abap-adt-api into a MCP server.,https://smithery.ai/server/@mario-andreschak/mcp-abap-abap-adt-api,Remote,
Xero MCP Server,A Model Context Protocol server that can connect LLM to your Xero account,https://smithery.ai/server/@john-zhang-dev/xero-mcp,Local,
Echo,Enhance your applications with real-time data interaction capabilities. Seamlessly integrate and manipulate external resources and tools to enrich user experiences. Empower your agents to respond dynamically with contextual information and actions.,https://smithery.ai/server/@Erik-Kim/mcp-echo,Local,
Perplexity MCP Server,Request chat completions with citations from Perplexity. Enhance your applications with powerful conversational capabilities by integrating the Perplexity API seamlessly. Experience efficient and informative interactions with minimal setup.,https://smithery.ai/server/@xiyuefox/mcp-server-perplexity,Remote,
MCP Finder,Discover and connect to Model Context Protocol servers effortlessly. Streamline your integration with various MCP servers to enhance your applications. Start finding the right MCP server for your needs today!,https://smithery.ai/server/@bbangjooo/mcp-finder-mcp-server,Remote,
Xero MCP Server,A Model Context Protocol server that can connect LLM to your Xero account,https://smithery.ai/server/@john-zhang-dev/xero-mcp,Local,
Logaflow,Enhance your applications with real-time logging and monitoring capabilities. Streamline your data flow and gain insights effortlessly with our powerful tools. Integrate seamlessly and elevate your development experience.,https://smithery.ai/server/@antunesgabriel/logaflow-mcp-server,Remote,
Autumn MCP Server,"Access the Autumn pricing API effortlessly to manage your customers. Create, retrieve, and manage customer entitlements and invoices, all through a simple interface. Generate billing portal links to enhance customer experience and streamline billing processes.",https://smithery.ai/server/@SirTenzin/autumn-mcp-server,Remote,
Brian Knows,Enhance your applications with intelligent context-aware capabilities. Leverage real-world data and tools seamlessly to create more interactive and responsive user experiences.,https://smithery.ai/server/@antoncoding/mcp-brianknows,Remote,
GitHub API MCP Server,"Manage your GitHub repositories effortlessly. Create, update, and search for files, issues, and pull requests with ease, all while preserving your Git history. Streamline your development workflow by automating repository management tasks.",https://smithery.ai/server/@thiagoainvestor/servers,Local,
Weather Server,Fetch real-time weather alerts and forecasts to enhance your LLM's environmental awareness. Connect seamlessly with Claude for Desktop to access up-to-date weather information for any US location. Stay informed with alerts and forecasts at your fingertips.,https://smithery.ai/server/@aitiwari/weather,Local,
Linear Integration Server,"Streamline your issue tracking with seamless integration to Linear. Create, update, and manage issues effortlessly while leveraging advanced search capabilities to enhance your workflow.",https://smithery.ai/server/@packetnomad/linear-mcp,Remote,
Farcaster MCP Server,Interact with the Farcaster Network to fetch and use casts.,https://smithery.ai/server/@manimohans/farcaster-mcp,Remote,
DuckDuckGo Search API,"Leverage DuckDuckGo's search capabilities to find text, images, news, and videos. Engage with AI chat for insightful conversations and receive summarized search results effortlessly.",https://smithery.ai/server/@ddkang1/ddg-mcp,Remote,
Jira Insights,"Manage your Jira Insights asset schemas effortlessly. Create, read, update, and delete object schemas and types, while querying objects using AQL for powerful insights. Streamline your Jira management with this comprehensive MCP server.",https://smithery.ai/server/@aaronsb/jira-insights-mcp,Remote,
Apple Tools,"Integrate seamlessly with Apple applications to manage messages, notes, emails, and more. Enhance your productivity by automating tasks across your Apple ecosystem with simple commands. Experience a streamlined workflow that connects your digital life effortlessly.",https://smithery.ai/server/@jxnl/apple-mcp,Local,
DiffuGen,"**REQUIRES A LOCAL STABLE-DIFFUSION.CPP INSTALL AND MODELS!**

Seamlessly generate AI images directly within your development workflow. Integrate with MCP-compatible IDEs for frictionless creative development and leverage multiple Stable Diffusion models for high-quality image generation with precise control over parameters.",https://smithery.ai/server/@CLOUDWERX-DEV/DiffuGen,Local,
Slack User MCP Server,Enable interaction with Slack workspaces as a user.,https://smithery.ai/server/@lars-hagen/slack-user-mcp,Remote,
Hevy Fitness API MCP Server,"Access and manage your workout data seamlessly. Integrate with the Hevy fitness tracking app to create, update, and organize workouts and routines effortlessly.",https://smithery.ai/server/@chrisdoc/hevy-mcp,Remote,
IP Geolocation Server,Retrieve detailed information about an IP address to determine user location and network details. Enhance your applications with geolocation capabilities using this simple and effective server. Get started quickly by integrating with the IPInfo API.,https://smithery.ai/server/@briandconnelly/mcp-server-ipinfo,Remote,
Keycloak,Manage users and realms in Keycloak.,https://smithery.ai/server/keycloak-model-context-protocol,Remote,
Solana Client,"Connect to the Solana blockchain and access its data seamlessly. Retrieve account balances, transaction details, and blockchain information with ease. Enhance your applications by integrating real-time Solana data and functionalities.",https://smithery.ai/server/@tywenk/mcp-solana,Remote,
Cloudinary Server,Upload images and videos to Cloudinary.,https://smithery.ai/server/@felores/cloudinary-mcp-server,Remote,
Replicate FLUX Image Generator,Generate images using advanced AI models and store them securely in the cloud. Easily create custom prompts and retrieve accessible image URLs for your projects.,https://smithery.ai/server/@andylee20014/mcp-replicate-flux,Remote,
Think Tool Server,Enhance Claude's reasoning capabilities by providing a structured thinking space for complex problem-solving. Utilize thought history and analysis to improve performance in tasks requiring detailed reasoning. Start fresh with the clean slate option to clear past thoughts and focus on new challenges.,https://smithery.ai/server/@ddkang1/mcp-think-tool,Remote,
MCP Server,"Integrate your applications with real-world data and tools seamlessly. Access files, databases, and APIs while leveraging the power of language models to enhance your workflows. Simplify complex interactions and automate tasks with a standardized protocol.",https://smithery.ai/server/@zick987/mcp,Local,
Apache Doris MCP Server,Connect to [Apache Doris](https://doris.apache.org/) seamlessly and leverage its powerful data processing capabilities. Simplify your data interactions and enhance your applications with a robust MCP server tailored for Doris. Experience efficient data management and querying with minimal setup.,https://smithery.ai/server/@morningman/mcp-doris,Remote,
chinarailway MCP 服务端,chinarailway MCP 服务端,https://smithery.ai/server/@other-blowsnow/mcp-server-chinarailway,Remote,
Test MCP Service,"Provide a simple and effective way to implement the Model Context Protocol. Easily integrate your applications with external data and tools, enhancing their capabilities. Start building your own MCP server with this example implementation.",https://smithery.ai/server/@lucyor/test-mcp-server,Local,
AST Model Context Protocol Server,"Integrate your applications with advanced language models to access real-time data and perform actions seamlessly. Enhance your workflows by leveraging tools and resources dynamically, ensuring a more interactive and efficient experience. Empower your agents with the ability to manipulate and reference real-world data effortlessly.",https://smithery.ai/server/@asleep-ai/ast-mcp,Remote,
Refine Prompt,"Transform ordinary prompts into powerful, structured instructions for any large language model. Enhance your AI interactions by refining your prompts for better understanding and response quality. Unlock the full potential of AI with expertly engineered prompts tailored to your needs.",https://smithery.ai/server/@FelippeFarias/refine-prompt,Remote,
