name,description,url,type,usage_count
Mesh Scanner,"Create and manage text notes effortlessly. Generate summaries of your notes with a simple command, enhancing your productivity and organization. Access your notes through unique URIs for easy retrieval and management.",https://smithery.ai/server/@DynamicEndpoints/mesh-scanner,Remote,
URL2SNAP,Capture and share webpage snapshots effortlessly. Integrate visual capture capabilities into your AI applications and automation workflows with a simple command. Enhance your LLM's functionality by enabling it to generate screenshots of any specified URL.,https://smithery.ai/server/@Abhi5h3k/MCP-URL2SNAP,Remote,
WildFly MCP Server,Integrate with your AI chatbot to interact with WildFly servers using natural language.,https://smithery.ai/server/@wildfly-extras/wildfly-mcp-server,Remote,
Gmail MCP (optional integration with Google Calendar),"Enhance your email management with intelligent, context-aware interactions. Analyze conversations, generate personalized replies, and seamlessly integrate with your calendar for efficient scheduling. Streamline your workflow and stay organized with advanced search and event detection capabilities.

Check README for seamless configuration process.",https://smithery.ai/server/@bastienchabal/gmail-mcp,Local,
Holaspirit,Interact with your Holaspirit data via API access.,https://smithery.ai/server/holaspirit-mcp-server,Remote,
Omi Uber MCP Server,Connect your Omi devices to Uber services seamlessly. Enable your devices to interact with Uber's API for enhanced functionality and convenience.,https://smithery.ai/server/@maximilien/omi-uber-mcp,Remote,
LlamaCloud,Connect to a managed index on LlamaCloud to retrieve information.,https://smithery.ai/server/mcp-server-llamacloud,Remote,
Git File Forensics,"Analyze individual file histories and changes in Git repositories. Gain insights into file versions, diffs, and semantic patterns to enhance your understanding of file evolution. Perfect for developers and analysts looking to dive deep into file-level forensics.",https://smithery.ai/server/@davidorex/git-file-forensics,Remote,
WireMCP,"Empower your LLMs with real-time network traffic analysis. Capture, analyze, and contextualize live network data to enhance threat detection and diagnostics. Transform complex packet captures into accessible insights for security audits and anomaly detection.",https://smithery.ai/server/@0xKoda/WireMCP,Remote,
Palo Alto Policy Management Server,"Manage your Palo Alto Networks firewall policies efficiently. Interact with firewall configurations through a standardized interface, enabling seamless policy management and integration with Palo Alto Networks API. Simplify your security management tasks with powerful tools for querying and modifying firewall rules.",https://smithery.ai/server/@DynamicEndpoints/palo-alto-policy-management-mcp-server,Remote,
BICScan,Obtain risk scores and detailed asset information for blockchain addresses and dApps. Leverage real-time scanning to assess potential risks and holdings securely. Integrate seamlessly with your applications using our powerful API.,https://smithery.ai/server/@ahnlabio/bicscan-mcp,Remote,
Linode MCP Server,"Connect to Linode's services seamlessly. Manage your Linode instances, volumes, domains, and more through a simple interface. Enhance your Claude Desktop experience with powerful cloud capabilities.",https://smithery.ai/server/@takashito/linode-mcp-server,Remote,
Claude Server,Manage project-specific contexts and maintain conversation continuity seamlessly. Organize your context with hierarchical structures and quick retrieval for efficient workflows. Enhance your interactions with rich metadata and flexible tagging systems.,https://smithery.ai/server/@davidteren/claude-server,Remote,
pure.md MCP server,"Access web content in markdown format reliably and efficiently. Unblock web pages and search the web seamlessly, enhancing your agents' capabilities. Integrate with your scripts and applications to leverage markdown delivery like a CDN.",https://smithery.ai/server/@puremd/puremd-mcp,Remote,
Toolbox for LLM Enhancement,"Enhance your LLM capabilities by integrating with external services and APIs. Execute commands, interact with Figma files, and extend functionality seamlessly. Leverage a comprehensive toolkit designed for developers to maximize the potential of LLMs.",https://smithery.ai/server/@ai-zerolab/mcp-toolbox,Local,
School MCP,"Fetch assignment deadlines, manage course materials, and integrate with your calendar seamlessly. Enhance your academic experience by automating reminders and file downloads from Canvas and Gradescope. Simplify your study schedule with easy access to essential academic tools.",https://smithery.ai/server/@54yyyu/school-mcp,Remote,
Simple JavaScript REPL,"Execute JavaScript code snippets securely in a sandboxed environment. Benefit from comprehensive error handling, memory management, and output formatting to enhance your coding experience. Ideal for testing and evaluating JavaScript code quickly and safely.",https://smithery.ai/server/@AnEntrypoint/mcp-repl,Remote,
R2 Gen,"An MCP server for image generation, utilizing Cloudflare Workers to store images in R2.
- Seamless integration with replicate-2-r2 worker
- Asynchronous image generation support
- Real-time status feedback
- Type-safe API calls
- Comprehensive error handling",https://smithery.ai/server/@agan2023416/workers,Remote,
OpenVision,"Analyze images effortlessly with advanced AI models. Leverage powerful vision capabilities to extract insights and details from your images, enhancing your AI assistant's functionality. Simplify image analysis tasks with a user-friendly interface and customizable queries.",https://smithery.ai/server/@Nazruden/mcp-openvision,Remote,
Armor Crypto,"Access blockchain, bridging, swapping, staking, and crypto trading strategies for your agent. Leverage powerful tools to manage wallets and execute trades seamlessly across multiple cryptocurrency ecosystems.",https://smithery.ai/server/@armorwallet/armor-crypto-mcp,Remote,
Sentry Server,Fetch and manage Sentry issue and event details seamlessly. Integrate with your Sentry projects to retrieve insights and streamline your debugging process. Enhance your workflow by leveraging Sentry's powerful API through a standardized interface.,https://smithery.ai/server/@zereight/sentry-mcp,Remote,
Sui Tools,"Interact seamlessly with the Sui blockchain and leverage powerful tools for managing SUI transactions. Request funds, check balances, and transfer assets effortlessly. Enhance your blockchain experience with a robust toolkit designed for developers and users alike.",https://smithery.ai/server/@0xdwong/sui-mcp,Remote,
Emergency Medicare Management,Find nearby hospitals and clinics that match specific patient needs. Access real-time information about medical facilities and calculate the fastest routes to them. Ensure timely medical assistance with this efficient planning tool.,https://smithery.ai/server/@manolaz/emergency-medicare-planner-mcp-server,Remote,
Playwright Visual Test,Run automated visual regression tests to ensure UI consistency across different viewport sizes. Capture screenshots and generate comparison reports to easily identify visual discrepancies. Integrate seamlessly with the MCP protocol for enhanced testing capabilities.,https://smithery.ai/server/@pengqiAngus/playwright-mcp,Remote,
Ramp MCP,Access your Ramp data seamlessly from any MCP client. Interact with your credit card transactions and spend management tools effortlessly. Enhance your financial insights with a simple command interface.,https://smithery.ai/server/@dragonkhoi/ramp-mcp,Remote,
MCP Multilspy,"Access language intelligence features seamlessly. Enhance your language model's capabilities with code completions, definitions, and static analysis across multiple programming languages.",https://smithery.ai/server/@asimihsan/mcp-multilspy,Remote,
Targetprocess MCP Server,"Interact with Targetprocess seamlessly to manage your project entities. Search, create, and update User Stories, Bugs, and more with powerful querying capabilities. Enhance your project management experience by integrating AI assistants with Targetprocess data.",https://smithery.ai/server/@aaronsb/apptio-target-process-mcp,Remote,
Eyevinn Open Source Cloud MCP Server,"MCP server for using the Eyevinn Open Source Cloud API, enabling creation of solutions based on open web services.",https://smithery.ai/server/@osaas/mcp-server,Remote,
Honeycomb MCP Server,"A server for interacting with Honeycomb observability data, enabling LLMs to analyze and query datasets.",https://smithery.ai/server/hny-mcp,Remote,
MercadoLibre MCP Server,"Access MercadoLibre's API to search products, retrieve reviews, and check seller reputations.",https://smithery.ai/server/@lumile/mercadolibre-mcp,Remote,
Time Server,Get current time information and perform timezone conversions effortlessly. Leverage IANA timezone names for accurate time queries and automatic system timezone detection to enhance your applications.,https://smithery.ai/server/@fisher1006/time-mcp-4,Remote,
Have I Been Pwned Integration Server,"Check if your accounts or passwords have been compromised in data breaches. Utilize powerful tools to verify email addresses, passwords, and get detailed breach information seamlessly.",https://smithery.ai/server/@Cyreslab-AI/hibp-mcp-server,Remote,
Figma MCP Python,Access Figma files and prototypes directly with your AI coding agents. Enhance your design workflow by integrating Figma seamlessly into your development environment. Simplify your design-to-code process and boost productivity with this powerful tool.,https://smithery.ai/server/@yuriduartetotvs/mcp_server,Local,
Illumio MCP Server,"Interact with your Illumio Policy Compute Engine using conversational AI. Manage workloads, labels, and analyze traffic flows effortlessly to enhance your security posture. Streamline your operations with programmatic access to critical workload management and security analysis features.",https://smithery.ai/server/@alexgoller/illumio-mcp-server,Remote,
Raygun Server,"Access Raygun's error tracking and monitoring data. View errors, crashes, and performance issues from your applications.",https://smithery.ai/server/@raygun.io/mcp-server-raygun,Remote,
App Store Connect Server,"An MCP server for interacting with the App Store Connect API, managing apps, beta testers, bundle IDs, and devices.",https://smithery.ai/server/appstore-connect-mcp-server,Remote,
YouTube Watch Later,MCP server for retrieving YouTube video URLs from a custom playlist within a specified timeframe.,https://smithery.ai/server/youtube-watchlater,Remote,
Atlas Docs,"Provide LLMs with hosted, clean markdown documentation for libraries and frameworks that they can immediately use.",https://smithery.ai/server/@CartographAI/atlas-docs-mcp,Remote,
Email Verification,Validate email addresses in real-time to ensure they are correctly formatted and deliverable. Integrate this capability seamlessly into your AI applications for enhanced user interaction and data accuracy.,https://smithery.ai/server/@Abhi5h3k/mcp-email-verify,Remote,
Hyperspell,Enhance your applications with real-time spell checking and correction capabilities. Improve user experience by ensuring text accuracy and clarity effortlessly. Integrate seamlessly with your existing workflows to provide instant feedback on spelling errors.,https://smithery.ai/server/@hyperspell/hyperspell-mcp,Remote,
APISIX Model Context Protocol Server,Enable natural language-based interaction for managing resources in APISIX through AI clients. Streamline your API management tasks by leveraging the power of large language models to interact with your APISIX setup effortlessly.,https://smithery.ai/server/@api7/apisix-mcp,Remote,
Azure AI Agent Service,"Connect your existing Azure AI Agents seamlessly and leverage their capabilities within any MCP client. Enhance your workflows with secure, isolated conversation histories and direct agent interactions. Experience the power of Azure AI Foundry's models and tools at your fingertips.",https://smithery.ai/server/@azure-ai-foundry/mcp-foundry,Remote,
My Apple Remembers,"Recall and save memories from your Apple Notes effortlessly. Access notes, calendar events, and files on your Mac, and persist important information for future reference with minimal setup. Enjoy universal compatibility across all macOS versions.",https://smithery.ai/server/@baryhuang/my-apple-remembers,Remote,
Flux Schnell Image Generator,Generate stunning images from text descriptions effortlessly. Leverage the power of the Flux Schnell model to transform your ideas into visual art. Perfect for developers looking to integrate image generation capabilities into their applications.,https://smithery.ai/server/@bytefer/mcp-flux-schnell,Remote,
Framer Plugin Server,"Create and manage Framer plugins with integrated web3 capabilities. Build plugins that connect wallets, interact with smart contracts, and display NFTs seamlessly. Enhance your Framer projects with powerful web3 features to engage users and expand functionality.",https://smithery.ai/server/@Sheshiyer/framer-plugin-mcp,Remote,
Nostr MCP Server,"Fetch and interact with Nostr network data seamlessly. Access user profiles, notes, and zaps with ease, enhancing your LLM's capabilities. Leverage advanced search features to explore Nostr Implementation Possibilities (NIPs) effectively.",https://smithery.ai/server/@AustinKelsay/nostr-mcp-server,Remote,
Calculate Server,"Perform complex mathematical calculations effortlessly. Leverage powerful symbolic computation capabilities to solve equations, perform calculus, and manipulate matrices with ease.",https://smithery.ai/server/@611711Dark/mcp_calculate_server,Remote,
Gemini Server,"Leverage Google's Gemini model capabilities seamlessly with your LLM applications. Generate text, manage stateful chats, and handle files efficiently through a standardized tool-based interface. Simplify your integration with powerful features designed for optimal performance and ease of use.",https://smithery.ai/server/@bsmi021/mcp-gemini-server,Remote,
PubMed Server,"Search and retrieve biomedical literature and research papers from PubMed efficiently. Utilize advanced search capabilities and API key support for faster, unlimited downloads of abstracts and full texts of open access articles.",https://smithery.ai/server/@t0mst0ne/pubmed-mcp-easy,Remote,
NodeMCU Manager,"Manage your NodeMCU (ESP8266) IoT devices effortlessly. Monitor device status, send commands, and update configurations remotely while integrating seamlessly with AI tools like Claude Desktop.",https://smithery.ai/server/@amanasmuei/nodemcu-mcp,Remote,
Atlassian Integration Server,"Integrate your Atlassian products with ease. Access Confluence content and Jira tickets directly through the MCP interface, streamlining your workflow and enhancing productivity.",https://smithery.ai/server/@petrsovadina/mcp-atlassian,Remote,
mcp服务,Provide a service for managing and interacting with model context protocols. Enhance your applications by integrating with external data and tools seamlessly.,https://smithery.ai/server/@ly729027676/mcp-serve-testweather,Remote,
Bluesky MCP Server,"Connect to Bluesky and interact with the ATProtocol using natural language. Fetch, analyze, and post content seamlessly within your LLM applications. Enhance your experience by leveraging Bluesky's features directly in your context window.",https://smithery.ai/server/@brianellin/bsky-mcp-server,Remote,
Iceberg Catalog,"Manage and query your Apache Iceberg tables effortlessly. Leverage a SQL interface to interact with your Iceberg data lake directly from Claude Desktop, enabling seamless data operations and management.",https://smithery.ai/server/@ahodroj/mcp-iceberg-service,Remote,
Fetch Server,"Retrieve and process web content effortlessly. Convert HTML to markdown for easier consumption by LLMs, allowing for efficient information extraction from web pages. Utilize advanced features like content truncation and customizable user agents to enhance your web fetching capabilities.",https://smithery.ai/server/@zxsimple/reference-servers,Remote,
Browserbase MCP Server,"Automate cloud browser interactions and extract data seamlessly. Enhance your AI applications with capabilities like web navigation, screenshot capture, and JavaScript execution in a cloud environment.",https://smithery.ai/server/@1050202387/mcp-server-browserbase,Remote,
PlayFab Server,"Connect your AI assistant with PlayFab services to access item searches, player profiles, and segment information seamlessly. Enable natural interactions with PlayFab data through your LLM client. Start leveraging PlayFab functionalities effortlessly with this middleware solution.",https://smithery.ai/server/@akiojin/playfab-mcp-server,Remote,
Two Truths and a Twist,"Engage in a fun trivia game where you identify the false statement among two truths. Experience interactive gameplay powered by AI, making each round unique and entertaining. Connect your MCP-compatible LLM to enjoy a seamless gaming experience.",https://smithery.ai/server/@ErgodicLabs/twotruthsandatwist,Remote,
Google Search Console Integration,"Connect with Google Search Console to analyze your SEO data through natural language conversations. Gain insights into property management, search analytics, URL inspection, and sitemap management effortlessly. Visualize your data and receive actionable recommendations to enhance your website's performance.",https://smithery.ai/server/@AminForou/mcp-gsc,Remote,
Wait,Pause execution for a specified duration while providing progress updates. Easily integrate waiting functionality into your applications with a simple CLI or HTTP server interface.,https://smithery.ai/server/@automation-ai-labs/mcp-wait,Remote,
MLflow Prompt Registry Server,Access and manage prompt templates seamlessly from MLflow. Load and utilize prompt templates in Claude Desktop for efficient task automation and workflow management.,https://smithery.ai/server/@B-Step62/mcp-server-mlflow,Remote,
Search Intent Analysis Service,"Analyze user search keywords to uncover intent and enhance SEO strategies. Gain insights into possible categories, reasoning, and related references to improve search effectiveness.",https://smithery.ai/server/@captainChaozi/search-intent-mcp,Remote,
Confluence MCP Server,"Interact with Confluence content seamlessly. Retrieve, create, and update pages, comments, and attachments through a standardized interface, enhancing your AI assistant's capabilities.",https://smithery.ai/server/@cosmix/confluence-mcp,Remote,
Powerdrill MCP Server,"Authenticate and interact with your Powerdrill datasets effortlessly. List datasets, get detailed information, and create jobs using natural language questions. Enhance your data analysis capabilities with seamless integration into your existing tools.",https://smithery.ai/server/@powerdrillai/powerdrill-mcp,Remote,
IoTDB MCP Server,"Enable secure interaction with IoTDB databases. Run SQL queries to read data and explore database schemas through a controlled interface, making database exploration and analysis safer and more structured.",https://smithery.ai/server/@apache/iotdb-mcp-server,Remote,
Calculator Server Example,This is an example of how to build a very simple mcp server which enhances your AI models with some basic mathematical operations.,https://smithery.ai/server/@simonberner/mcp-server-calculator,Remote,
LeetCode MCP Server,"Access LeetCode problems, user information, and contest data seamlessly. Enhance your AI assistants with fast and efficient queries to LeetCode's extensive resources. Utilize both CLI and programmable API for flexible integration.",https://smithery.ai/server/@doggybee/mcp-server-leetcode,Remote,
Webflow MCP Server,Enable AI agents to seamlessly interact with Webflow's powerful APIs. Simplify your web development workflow by automating tasks like site publishing and content management directly from your AI tools.,https://smithery.ai/server/@webflow/mcp-server,Remote,
Task Manager,Manage multi-step tasks efficiently with user approval checkpoints. Streamline your project workflows and track progress seamlessly with this powerful task management tool.,https://smithery.ai/server/@chriscarrollsmith/taskqueue-mcp,Remote,
Document Management Server,"Crawl, index, and manage documentation seamlessly. Enable full-text search across various document formats to enhance your information retrieval. Integrate with AI context for smarter document access and management.",https://smithery.ai/server/@askme765cs/open-docs-mcp,Remote,
Practices MCP Server,"Enhance your development workflows by automating Git operations and ensuring consistent practices across your projects. Utilize natural language commands to manage branches, versioning, and pull requests seamlessly with AI assistance. Integrate with tools like GitHub and Jira to streamline your development process.",https://smithery.ai/server/@agentience/practices_mcp_server,Remote,
GitHub API MCP Server,"Enable seamless file operations, repository management, and advanced search functionalities on GitHub. Automate your workflows with automatic branch creation and comprehensive error handling, all while preserving Git history. Enhance your development experience by integrating GitHub capabilities directly into your applications.",https://smithery.ai/server/@lowkeyrd/servers,Remote,
WebAgentQA,Start your server and let your code agent debug your web application effortlessly. Enhance your development workflow by integrating advanced AI capabilities to automate testing and debugging. Simplify your coding process with intelligent assistance from the WebAgentQA.,https://smithery.ai/server/@Operative-Sh/web-agent-qa,Remote,
Memory Bank,"Manage your AI assistant's context seamlessly across sessions. Store, retrieve, and track information with remote server support for enhanced collaboration and persistence.",https://smithery.ai/server/@aakarsh-sasi/memory-bank-mcp,Remote,
Memento,"Enhance your LLM applications with a scalable knowledge graph memory system. Utilize semantic search and temporal awareness to manage and retrieve information effectively, ensuring your agents have persistent and contextual memory capabilities.",https://smithery.ai/server/@gannonh/memento-mcp,Remote,
Flux Schnell,Generate stunning images from text prompts using the Replicate API. Leverage the power of AI to create unique visuals tailored to your specifications. Simply provide a detailed description and let the server handle the rest.,https://smithery.ai/server/@ckz/flux-schnell-mcp,Remote,
OneSearch,"Enable seamless web search, scraping, and content extraction from various sources. Leverage multiple search engines and scrapers to enhance your data retrieval capabilities. Integrate effortlessly with self-hosted solutions for customized search experiences.",https://smithery.ai/server/@yokingma/one-search,Remote,
Frontapp Integration Server,"Integrate your Large Language Models with Frontapp to manage customer communications seamlessly. Automate workflows and access conversation data using natural language commands, enhancing your customer support capabilities.",https://smithery.ai/server/@zqushair/frontapp-mcp,Remote,
Generate Image from HTML,"Create images from HTML content effortlessly. Store and summarize notes with a simple interface, enhancing your productivity and organization. Utilize a custom URI scheme for easy access to your notes and generate tailored summaries based on your preferences.",https://smithery.ai/server/@sdaaron/generate_image_from_html,Remote,
Supabase MCP Server (used by Deploya.dev),Manage your Supabase databases and execute SQL queries autonomously and securely. Leverage built-in safety controls while interacting with your database through Cursor and Windsurf. Simplify your database management with a feature-rich interface that enhances productivity.,https://smithery.ai/server/@Deploya-labs/mcp-supabase,Remote,9.98k
Memory Bank Server,Manage project memory banks remotely and efficiently.,https://smithery.ai/server/@alioshr/memory-bank-mcp,Remote,9.09k
MySQL Server,A Model Context Protocol server that provides read-only access to MySQL databases. This server enables LLMs to inspect database schemas and execute read-only queries.,https://smithery.ai/server/@benborla29/mcp-server-mysql,Remote,2.73k
Clear Thought MCP Server,Enhance problem-solving capabilities using systematic thinking and mental models.,https://smithery.ai/server/@waldzellai/clear-thought,Remote,2.44k
Redis Server,Provides tools for interacting with Redis databases.,https://smithery.ai/server/redis-mcp,Remote,2.21k
Supabase MCP Server,"Enable your favorite IDE to safely execute SQL queries, manage your database end-to-end, access Management API, and handle user authentication with built-in safety controls.",https://smithery.ai/server/@medieage/supabase-mcp-server,Remote,2.10k
BigQuery,"Provides secure, read-only access to BigQuery datasets. Enables natural language querying of BigQuery data with a 1GB processing limit.",https://smithery.ai/server/@ergut/mcp-bigquery-server,Remote,1.58k
Selenium WebDriver Automation,Enable browser automation through standardized MCP clients.,https://smithery.ai/server/@angiejones/mcp-selenium,Local,
Elasticsearch Server,Interact with Elasticsearch for searching documents and managing clusters.,https://smithery.ai/server/elasticsearch-mcp-server,Remote,
Browser Use (used by Deploya.dev),"Automate your web browsing tasks with AI-driven control. Navigate pages, fill forms, and interact with elements using natural language commands. Enhance your browsing experience with visual understanding and state persistence across sessions.",https://smithery.ai/server/@Deploya-labs/mcp-browser-use,Remote,
